https://www.ds57.xyz/movie.php?id=7131063183769584,最新台湾SWAG幻装女神『janpet』年终粉丝福利 黑丝女仆子宫高潮 爆操内射小双马童颜纯真的性爱 高清720P版
https://www.ds57.xyz/movie.php?id=8412941936403513,年轻可爱嫩妹主播小熊软糖肛塞塞菊花 跳蛋插骚穴
https://www.ds57.xyz/movie.php?id=8412941936403513,年轻可爱嫩妹主播小熊软糖肛塞塞菊花 跳蛋插骚穴
https://www.ds57.xyz/movie.php?id=2251542536541819,大鸡巴哥和老爹共用一个大奶子熟女骚货道具搞鸡巴爆菊毒龙吹到射真过瘾720P高清
https://www.ds57.xyz/movie.php?id=760531183332204,黑人大战花臂纹身妹子-性感牛仔裤大黑屌后入暴插抱起来干上位骑乘暴菊花-1080P高清
https://www.ds57.xyz/movie.php?id=9269976555369794,极品网红尤物阿姨洗太绿超高颜值S身形巨乳自拍淫乱生活33V整合4V阴蒂J8抹牙膏打炮肛塞肛交呻吟刺激3
https://www.ds57.xyz/movie.php?id=1763485497795045,云盘泄密-肤白貌美的援交美女为了挣钱公寓同时被4个中年男啪啪,前后双插,轮流爆操,干的淫声不断,逼逼都肿了...
https://www.ds57.xyz/movie.php?id=5054859695956111,颜值不错御姐幼师直播大秀 无毛粉嫩小穴 激情自慰
https://www.ds57.xyz/movie.php?id=806404617615044,胸大腰细屁股翘的高颜值性感商务美女嫩模酒店援交2男,掀开裙子发现没穿内裤按在天窗就开干,又到床上前后双...
https://www.ds57.xyz/movie.php?id=1407664036378264,刚破处2个多月就被男友甩了的168CM高颜值美女兼职援交,人美逼紧刚干完一次还没休息又被操,不舍的让她走!
https://www.ds57.xyz/movie.php?id=3432512753643095,清纯可爱高中女孩与男友在家做爱视频
https://www.ds57.xyz/movie.php?id=996735240332782,36E穴小奶大的人妻美女上演被包养的继续卧室啪啪,各种姿势干的啪啪响,说屁眼都被操了,国语淫荡对白!
https://www.ds57.xyz/movie.php?id=681149326264858,打飞机推荐宅男女神超高人气童颜巨乳主播三胖戴着黑框眼镜好像AV里的老师
https://www.ds57.xyz/movie.php?id=2173309898935258,和性感女神到酒店开房 跪在沙发上撅着屁股被猛操大声浪叫再推倒在床上修长大腿无套内射
https://www.ds57.xyz/movie.php?id=7740565789863467,【网曝门事件】超靓东航空姐韩X和男友性爱私拍流出 制服女神翘丰臀抽插后入 黑牛大屌双插浪叫 高清720P版
https://www.ds57.xyz/movie.php?id=1280923336744308,敏感学生妹露脸被蒙面大哥床上玩逼捅菊花，大鸡巴各种体位抽插爆草蹂躏，表情骚极了，不断呻吟还自己抠穴
https://www.ds57.xyz/movie.php?id=3609339818358421,小姐姐平台很是风骚嫩妹主播骚幼师欠 收费直播大秀 自慰工具好多 插穴爆菊花十分淫荡
https://www.ds57.xyz/movie.php?id=3609339818358421,小姐姐平台很是风骚嫩妹主播骚幼师欠 收费直播大秀 自慰工具好多 插穴爆菊花十分淫荡
https://www.ds57.xyz/movie.php?id=3121288223192096,颜值不错妹子天台楼梯道具自慰秀 翘起屁股肛塞插菊花道具JJ抽插呻吟娇喘
https://www.ds57.xyz/movie.php?id=3121288223192096,颜值不错妹子天台楼梯道具自慰秀 翘起屁股肛塞插菊花道具JJ抽插呻吟娇喘
https://www.ds57.xyz/movie.php?id=3121288223192096,颜值不错妹子天台楼梯道具自慰秀 翘起屁股肛塞插菊花道具JJ抽插呻吟娇喘
https://www.ds57.xyz/movie.php?id=6339817903935909,女神级主播骚浪美女兔兔全程露脸直播，情趣内衣很诱惑大白屁股非常俏，奶子嫩出水很大自己吃，手指抠逼叫声淫荡
https://www.ds57.xyz/movie.php?id=7978875981643796,【喂奶良家小萍萍】哺乳期乳汁喷射到屏幕，跟老公趁孩子睡着啪啪，后入翘起大白臀诱人内射
https://www.ds57.xyz/movie.php?id=6517554023303092,高颜值杭州大二D奶学生妹 动感裸舞 假JB插穴爆菊自慰 有点像低配版迪丽热巴
https://www.ds57.xyz/movie.php?id=7855815635994077,每月5位数包养的腰细臀美的女神级性感美女酒店被土豪疯狂抽插调教,屁股上写的都是淫话,各种体位狠狠干逼!
https://www.ds57.xyz/movie.php?id=7374418890103698,国产妹虐肛大合集-菊花下蛋,扩张,灌肠,菊花喷奶,虐肛,拉粑粑插肛，喜欢屁眼的进
https://www.ds57.xyz/movie.php?id=7374418890103698,国产妹虐肛大合集-菊花下蛋,扩张,灌肠,菊花喷奶,虐肛,拉粑粑插肛，喜欢屁眼的进
https://www.ds57.xyz/movie.php?id=7374418890103698,国产妹虐肛大合集-菊花下蛋,扩张,灌肠,菊花喷奶,虐肛,拉粑粑插肛，喜欢屁眼的进
https://www.ds57.xyz/movie.php?id=7374418890103698,国产妹虐肛大合集-菊花下蛋,扩张,灌肠,菊花喷奶,虐肛,拉粑粑插肛，喜欢屁眼的进
https://www.ds57.xyz/movie.php?id=7374418890103698,国产妹虐肛大合集-菊花下蛋,扩张,灌肠,菊花喷奶,虐肛,拉粑粑插肛，喜欢屁眼的进
https://www.ds57.xyz/movie.php?id=7425680002197623,唯美女同大片接吻舔菊花道具JJ插对方淫叫不断喜欢的不要错过
https://www.ds57.xyz/movie.php?id=1264887838624417,苗条身材短发妹子道具自慰秀 性感屁股后入套弄震动抽插出白浆逼逼刮毛了 很是诱惑不要错过
https://www.ds57.xyz/movie.php?id=6509390473365784,亚裔小美女直播与洋男友激烈床战 可爱童颜身材高挑 被大洋屌贯穿爽得直叫
https://www.ds57.xyz/movie.php?id=1584735922515392,奶子大逼儿肥颜值高的骚主播全程高能演绎，自己揉捏坚挺大奶很诱人，肥逼特写道具插入菊花也爆，高潮喷水第二弹
https://www.ds57.xyz/movie.php?id=2962144999764859,对白淫荡粗暴91大变态调教虐待眼镜骚妹纸开双洞口爆吐精自己扇自己嘴巴子很黄很暴力感觉妹子还高潮了720P高...
https://www.ds57.xyz/movie.php?id=5887427818961442,性感少妇露脸一个人在家没有老公很寂寞，黑丝情趣各种诱惑身材不错，撅着屁股自慰床上爬着等你来干，不要错过
https://www.ds57.xyz/movie.php?id=3019548179581761,大奶妹子主播 道具插菊花 床上用炮机自慰 快速抽插呻吟 菊花和逼逼同时被插 非常精彩
https://www.ds57.xyz/movie.php?id=9504814688116312,骚女【丝袜控】肉丝高跟鞋跳蛋塞逼自慰，跑步机上扭动屁股拉扯跳蛋
https://www.ds57.xyz/movie.php?id=5237450180575252,高颜值翘臀黑衣美女好技术搞穴刺激啪啪作品 妹子这大屁股摩擦的太销魂了，挡不住冲动硬了想插入啊720P高清
https://www.ds57.xyz/movie.php?id=4553050277754664,刚直播时间不长的小妞露脸玩的已经很嗨了，护士情趣服黑丝高跟，骚浪淫语小逼很嫩，两个道具玩逼到高潮爆菊
https://www.ds57.xyz/movie.php?id=8552219504490495,黑人大战白人妹子-花臂纹身长发妹子3P大屌黑人双洞齐插暴力抽插深插到底-1080P高清
https://www.ds57.xyz/movie.php?id=2002285323105752,奶大屁股圆的社会大姐，露脸与炮友啪啪，开档黑丝情趣舔着大鸡巴，在椅子上与大哥嗨皮，各种体位抽插内射
https://www.ds57.xyz/movie.php?id=1267469553276896,91新人罗伊大大11月最新原作-调操大一双马尾18岁嫩鲍美穴萝莉 道具大屌强双插调教 拽着胳膊后入爆操小骚货...
https://www.ds57.xyz/movie.php?id=155827747657895,高清粤语对白香港佬与内地情妇自拍舔完屁眼还敢亲吻 女的主动上位，看来这段日子太寂寞了
https://www.ds57.xyz/movie.php?id=8797574052587152,韩国女主播各种骚浪诱惑，情趣高跟，奶头特写，屁股非常翘
https://www.ds57.xyz/movie.php?id=7929112040437758,半推半就到顺从主动很会装假的大屁股少妇
https://www.ds57.xyz/movie.php?id=4432626031339168,爱扎人的小爽玩滴蜡诱惑黑丝情趣，奶子很挺骚逼特写，水好多让狼友选个道具玩，撅着屁股自己插好淫荡，叫声好骚
https://www.ds57.xyz/movie.php?id=9676793091930450,骚气魅心户外秀自行车上放道具JJ抽插车内肛塞震动棒自慰高潮喷水很是诱惑
https://www.ds57.xyz/movie.php?id=154048847034573,黑丝大奶骚姐姐露脸真是个水做的女人，自慰骚逼淫水流不停下面放个盆都快接满了，黄瓜双插粑粑都干出来了
https://www.ds57.xyz/movie.php?id=7222251817584038,最近很火的实力男主播龙哥一本正经的向大家介绍要去和从没大秀过的靓妹约炮看逼逼妹子貌似处女
https://www.ds57.xyz/movie.php?id=676956186071038,高颜值小姐姐和粉丝约啪 F奶纤细柳腰 模特身材 口交肛交啪啪 口爆射到喉咙干呕不止
https://www.ds57.xyz/movie.php?id=2966142371296882,北京文艺小青年与女友自拍性行为艺术小电影初恋小姐被老师破处后的堕落
https://www.ds57.xyz/movie.php?id=6551512121222913,【我的高中女同学们】3女1男淫乱大战丝袜黑丝自慰小伙连开两炮一次对付三个真是爽翻了应接不暇
https://www.ds57.xyz/movie.php?id=3722601910121739,酒窝美素人宾馆和壮丁约拍被草爽了 开发菊花高潮不断
https://www.ds57.xyz/movie.php?id=7358714505098760,最新极品网红『香软多汁』情趣露臀黑丝肛塞狐狸尾巴 浴室湿身诱惑 自慰呻吟
https://www.ds57.xyz/movie.php?id=9857043311931192,这样的淫荡生活太向往了游玩群交刺激挡不住美女大长腿啪啪 妹子有肉有身材屁股翘着肉肉叠加操虚了720P高清
https://www.ds57.xyz/movie.php?id=8443838055245578,Christy跪地滴蜡开场主观视角女仆装挨操附肛门开发片段（番号014）-by 海哥
https://www.ds57.xyz/movie.php?id=8898691483773291,颜值不错身材苗条美女主播情趣肚兜丁字裤自慰秀 淫语骚话翘着屁股后入
https://www.ds57.xyz/movie.php?id=6614728374406695,白皙皮肤萌妹子双人啪啪大秀 性感大白屁股上位骑乘后入猛操非常诱人
https://www.ds57.xyz/movie.php?id=9515013638883830,骚气少妇主播双人啪啪秀深喉口交一番再后入大白屁股 呻吟娇喘很是诱惑
https://www.ds57.xyz/movie.php?id=2472901754081249,这个牛逼了玩弄骚熟女将近6小时，情趣装黑丝高跟各种诱惑，不玩骚逼直播走后门，爆草菊花听少妇的叫声把
https://www.ds57.xyz/movie.php?id=2472901754081249,这个牛逼了玩弄骚熟女将近6小时，情趣装黑丝高跟各种诱惑，不玩骚逼直播走后门，爆草菊花听少妇的叫声把
https://www.ds57.xyz/movie.php?id=9831187133677304,果哥出品黑丝长腿网红脸模特蕾丝情趣装崛起大屁股翘臀多姿势摆拍
https://www.ds57.xyz/movie.php?id=8505718586966395,大肥屁股留学生贱货李美静被野蛮人男友沙发上爆肏太生猛了干到高潮尖叫内射1080P高清原版
https://www.ds57.xyz/movie.php?id=1565579734742641,留美大学生李美静与同居男友激情嗨炮弹性大肥臀非常诱人暴力深喉干完B洞再干屁眼高潮不断表情丰富2连发1080...
https://www.ds57.xyz/movie.php?id=5955190784297884,微博miaotutu付费之穹妹COS黑丝灌肠合集
https://www.ds57.xyz/movie.php?id=7546948650851846,鹅蛋脸整过容的娃娃脸女神 坚挺的巨乳 典型的童颜巨乳 小穴粉得过分 加上筷子版的长美腿 简直就是人间般尤...
https://www.ds57.xyz/movie.php?id=5140165467746556,00后颜值女神约啪炮友 大屌深入骑马后入 撅着白雪屁股 无套啪啪 射的满肚子都是精华
https://www.ds57.xyz/movie.php?id=7654439616017044,被灌醉后的学生妹成了死猪一头，随意玩没任何知觉，肛门松弛全开爆菊肛交、虐玩胸、解锁奇葩难度姿势啪啪等，包含...
https://www.ds57.xyz/movie.php?id=7654439616017044,被灌醉后的学生妹成了死猪一头，随意玩没任何知觉，肛门松弛全开爆菊肛交、虐玩胸、解锁奇葩难度姿势啪啪等，包含...
https://www.ds57.xyz/movie.php?id=4151955568231642,四川某高校神颜值美女大学生宿舍床上拉上布帘全裸掰穴直播处女膜，她室友知道她的肮脏面目吗？
https://www.ds57.xyz/movie.php?id=7964089871384203,粉嫩逼逼苗条身材嫩妹子自慰秀 逼逼微毛床上自摸阴蒂呻吟翘起屁股非常诱人
https://www.ds57.xyz/movie.php?id=5866371970623732,高颜值美女性感黑丝无毛蛮腰翘臀开房与男友造爱销魂自摸肉棒吃硬直接肛交内射男主罕见露脸1080P原版
https://www.ds57.xyz/movie.php?id=4604588067159057,这样的圣诞节太性福双飞两个高质量美少女嫩逼啪啪插入销魂作品 妹子白嫩跪爬屁股翘着受不了要肾虚了720P高...
https://www.ds57.xyz/movie.php?id=8445212938822806,喷水女王白富美主播黄瓜双插爆菊大秀,黄瓜都不带套真怕断在骚B里面
https://www.ds57.xyz/movie.php?id=8445212938822806,喷水女王白富美主播黄瓜双插爆菊大秀,黄瓜都不带套真怕断在骚B里面
https://www.ds57.xyz/movie.php?id=6158043015748262,高颜值美女丑曦收费诱惑秀 苗条身材抖动屁股非常诱人近距离特写肥逼
https://www.ds57.xyz/movie.php?id=9805421652272344,性感漂亮的少妇美女酒店被恋屁控领导从后面扶着丰满翘臀用力抽插,中间还换了套性感睡衣,干的美女欲死欲仙!
https://www.ds57.xyz/movie.php?id=3378447964787483,国外情侣啪啪视讯秀大长吊男友多种姿势换着操后入上位 性感大屁股
https://www.ds57.xyz/movie.php?id=9466309892013670,粗黑大鸡巴打桩机似的猛操大屁股小骚逼，看得很刺激
https://www.ds57.xyz/movie.php?id=2510638707317412,一男两个熟女双飞啪啪大秀 69互舔道具插菊花再骑脸舔逼上位猛插
https://www.ds57.xyz/movie.php?id=9654459711164236,【全国探花】深夜约了个粉衣腰细胸大妹子，扭动性感大屁股后入大力猛操
